{
  "schemaVersion": 1,
  "format": "embeddedknowledge-chart-v1",
  "id": "chart-group-means-zero-axis",
  "type": "bar",
  "title": "The same two means, vertical axis starting at zero",
  "alt": "The same two bars, 137.5 and 146.5 mg/dL, on an axis starting at zero, where the two heights look nearly the same.",
  "longDescription": "The bars carry the same two numbers as the previous chart: 137.5 mg/dL for the earlier-dinner group and 146.5 mg/dL for the later-dinner group, a difference of 9.0 mg/dL. Here the vertical axis starts at zero, so each bar's height is proportional to the mean it represents. The later bar is about 6.5 percent taller than the earlier one, which is close to the edge of what an eye reliably picks out. Neither chart is wrong about the numbers; the two pictures disagree about how large 9.0 mg/dL looks, and the axis choice is what changed.",
  "xAxis": {
    "label": "Dinner group",
    "unit": null,
    "min": 0,
    "max": 1,
    "ticks": [{ "at": 0, "label": "" }]
  },
  "yAxis": {
    "label": "Mean fasting glucose",
    "unit": "mg/dL",
    "min": 0,
    "max": 160,
    "ticks": [
      { "at": 0, "label": "0" },
      { "at": 40, "label": "40" },
      { "at": 80, "label": "80" },
      { "at": 120, "label": "120" },
      { "at": 160, "label": "160" }
    ]
  },
  "series": [
    {
      "id": "series-group-means-zero",
      "label": "Mean fasting glucose",
      "categories": [
        { "label": "Earlier dinner (30 people)", "value": 137.5 },
        { "label": "Later dinner (30 people)", "value": 146.5 }
      ]
    }
  ]
}
