{
  "schemaVersion": 1,
  "format": "embeddedknowledge-chart-v1",
  "id": "chart-bimodal-counter-case",
  "type": "histogram",
  "title": "A constructed cohort with the same mean of 142 mg/dL and two humps",
  "alt": "Histogram of a constructed 60-person cohort with two separate humps and a near-empty gap at the mean of 142 mg/dL.",
  "longDescription": "This is not the study cohort. It is a constructed set of 60 values with exactly the same mean, 142 mg/dL, arranged in the same nine bins 10 mg/dL wide. Reading from the left, the counts are 2 people from 95 to 105 mg/dL, 8 from 105 to 115, 12 from 115 to 125, 6 from 125 to 135, 2 from 135 to 145, 4 from 145 to 155, 12 from 155 to 165, 10 from 165 to 175, and 4 from 175 to 185. There are two humps, one near 120 mg/dL and one near 160, with a near-empty gap between them. The mean of 142 mg/dL, marked by a vertical line, falls inside that gap: only 2 of the 60 people sit in the bin containing it. The mean is arithmetically correct and describes almost nobody in the group.",
  "xAxis": {
    "label": "Fasting glucose",
    "unit": "mg/dL",
    "min": 95,
    "max": 185,
    "ticks": [
      { "at": 95, "label": "95" },
      { "at": 105, "label": "105" },
      { "at": 115, "label": "115" },
      { "at": 125, "label": "125" },
      { "at": 135, "label": "135" },
      { "at": 145, "label": "145" },
      { "at": 155, "label": "155" },
      { "at": 165, "label": "165" },
      { "at": 175, "label": "175" },
      { "at": 185, "label": "185" }
    ]
  },
  "yAxis": {
    "label": "Number of people",
    "unit": null,
    "min": 0,
    "max": 15,
    "ticks": [
      { "at": 0, "label": "0" },
      { "at": 3, "label": "3" },
      { "at": 6, "label": "6" },
      { "at": 9, "label": "9" },
      { "at": 12, "label": "12" },
      { "at": 15, "label": "15" }
    ]
  },
  "series": [
    {
      "id": "series-constructed-two-humps",
      "label": "People in each 10 mg/dL bin",
      "bins": [
        { "from": 95, "to": 105, "count": 2 },
        { "from": 105, "to": 115, "count": 8 },
        { "from": 115, "to": 125, "count": 12 },
        { "from": 125, "to": 135, "count": 6 },
        { "from": 135, "to": 145, "count": 2 },
        { "from": 145, "to": 155, "count": 4 },
        { "from": 155, "to": 165, "count": 12 },
        { "from": 165, "to": 175, "count": 10 },
        { "from": 175, "to": 185, "count": 4 }
      ]
    }
  ],
  "markers": [
    { "x": 142, "label": "Mean 142 mg/dL" }
  ]
}
