{
  "schemaVersion": 1,
  "format": "embeddedknowledge-chart-v1",
  "id": "chart-fasting-glucose-histogram",
  "type": "histogram",
  "title": "Fasting glucose in the illustrative 60-person cohort, bins 10 mg/dL wide",
  "alt": "Histogram of 60 fasting glucose values, one hump peaking between 135 and 145 mg/dL with a longer tail to the right.",
  "longDescription": "Sixty fasting glucose values are grouped into nine bins 10 mg/dL wide, running from 95 to 185 mg/dL. Counts rise from 1 person in the 95 to 105 bin to 13 people in the 135 to 145 bin, then fall to 2 people in the 175 to 185 bin. The bins are 1, 3, 6, 11, 13, 12, 8, 4 and 2 people. The cohort has one hump rather than two, so a single centre describes it sensibly. The left side falls away faster than the right, so the tail reaching towards 185 mg/dL is longer than the tail reaching towards 95 mg/dL. The mean of 142 mg/dL, marked by a vertical line, sits just right of the tallest bin. Six people sit at or above 165 mg/dL and one sits below 105 mg/dL; both groups are invisible in the mean.",
  "xAxis": {
    "label": "Fasting glucose",
    "unit": "mg/dL",
    "min": 95,
    "max": 185,
    "ticks": [
      { "at": 95, "label": "95" },
      { "at": 105, "label": "105" },
      { "at": 115, "label": "115" },
      { "at": 125, "label": "125" },
      { "at": 135, "label": "135" },
      { "at": 145, "label": "145" },
      { "at": 155, "label": "155" },
      { "at": 165, "label": "165" },
      { "at": 175, "label": "175" },
      { "at": 185, "label": "185" }
    ]
  },
  "yAxis": {
    "label": "Number of people",
    "unit": null,
    "min": 0,
    "max": 15,
    "ticks": [
      { "at": 0, "label": "0" },
      { "at": 3, "label": "3" },
      { "at": 6, "label": "6" },
      { "at": 9, "label": "9" },
      { "at": 12, "label": "12" },
      { "at": 15, "label": "15" }
    ]
  },
  "series": [
    {
      "id": "series-cohort-glucose",
      "label": "People in each 10 mg/dL bin",
      "bins": [
        { "from": 95, "to": 105, "count": 1 },
        { "from": 105, "to": 115, "count": 3 },
        { "from": 115, "to": 125, "count": 6 },
        { "from": 125, "to": 135, "count": 11 },
        { "from": 135, "to": 145, "count": 13 },
        { "from": 145, "to": 155, "count": 12 },
        { "from": 155, "to": 165, "count": 8 },
        { "from": 165, "to": 175, "count": 4 },
        { "from": 175, "to": 185, "count": 2 }
      ]
    }
  ],
  "markers": [
    { "x": 142, "label": "Mean 142 mg/dL" }
  ]
}
